{
  "$schema": "../packages/page-backdrop/schema/page-backdrop-config.schema.json",
  "enabled": false,
  "fileKey": "AbCdEf123456",
  "pages": [
    { "nodeId": "1:2", "id": "now-playing" },
    { "nodeId": "1:8", "id": "library" },
    { "nodeId": "1:14" }
  ],
  "scale": 2,
  "nested": false,
  "outDir": "design/pages",
  "overlay": {
    "enabled": false,
    "opacity": 0.5,
    "blend": "normal"
  }
}
